{
	"$schema": "../../src/core/tools/register.schema.json",
	"name": "tool_numisdata_acquisition",
	"version": "1.0.0",
	"label": {
		"lg-eng": "Import from auction URL"
	},
	"affected_models": [
		"section"
	],
	"affected_tipos": ["numisdata4"],
	"active": true,
	"properties": {
		"open_as": "modal"
	},
	"labels": [
		{ "lang": "lg-eng", "name": "url_placeholder", "value": "Paste an auction URL (jesusvico.com, biddr.com, aureo.com, numisbids.com, or sixbid.com)" },
		{ "lang": "lg-eng", "name": "preview", "value": "Preview" },
		{ "lang": "lg-eng", "name": "html_file_label", "value": "Or upload a saved HTML page (for sources that block automated fetching) — URL above still required:" },
		{ "lang": "lg-eng", "name": "request_failed", "value": "The request failed." },
		{ "lang": "lg-eng", "name": "job_done", "value": "Done." },
		{ "lang": "lg-eng", "name": "job_no_result", "value": "The job ended without a result." },
		{ "lang": "lg-eng", "name": "job_status_lost", "value": "Lost the job status; the job may still be running (process {pid})." },
		{ "lang": "lg-eng", "name": "job_check_again", "value": "Check again" },
		{ "lang": "lg-eng", "name": "company_unresolved", "value": "Choose the Entity for this auction first (the search has not answered, or it failed — search again)." },
		{ "lang": "lg-eng", "name": "job_working", "value": "Working…" },
		{ "lang": "lg-eng", "name": "auction_prefix", "value": "Auction: " },
		{ "lang": "lg-eng", "name": "auction_existing", "value": " (existing record #{id}, will link to it)" },
		{ "lang": "lg-eng", "name": "auction_new", "value": " (new — will be created)" },
		{ "lang": "lg-eng", "name": "auction_none", "value": "No auction info found for this URL." },
		{ "lang": "lg-eng", "name": "company_label", "value": "Company (links the auction to an Entity):" },
		{ "lang": "lg-eng", "name": "company_search", "value": "Search" },
		{ "lang": "lg-eng", "name": "company_create", "value": "Create new Entity" },
		{ "lang": "lg-eng", "name": "select_all", "value": "Select all" },
		{ "lang": "lg-eng", "name": "deselect_all", "value": "Deselect all" },
		{ "lang": "lg-eng", "name": "keyword_placeholder", "value": "Keyword…" },
		{ "lang": "lg-eng", "name": "include_matching", "value": "Include matching" },
		{ "lang": "lg-eng", "name": "exclude_matching", "value": "Exclude matching" },
		{ "lang": "lg-eng", "name": "lot_from", "value": "Lot # from" },
		{ "lang": "lg-eng", "name": "lot_to", "value": "to (excluded)" },
		{ "lang": "lg-eng", "name": "include_range", "value": "Include range" },
		{ "lang": "lg-eng", "name": "exclude_range", "value": "Exclude range" },
		{ "lang": "lg-eng", "name": "no_lots_found", "value": "No lots found at this URL." },
		{ "lang": "lg-eng", "name": "lots_truncated", "value": "Only the first {count} lots are shown ({more} more were found and left out)." },
		{ "lang": "lg-eng", "name": "confirm_import", "value": "Confirm import" },
		{ "lang": "lg-eng", "name": "nothing_kept", "value": "Every lot is excluded — nothing to import." },
		{ "lang": "lg-eng", "name": "commit_stopped", "value": "Stopped after {done} of {total} lots — the rest were not imported." },
		{ "lang": "lg-eng", "name": "url_not_detected", "value": "Could not detect this page's URL from the saved file — paste it above manually." },
		{ "lang": "lg-eng", "name": "url_missing", "value": "Paste a URL first." },
		{ "lang": "lg-eng", "name": "lot_not_imported", "value": "Lot {lot} NOT imported: {reason}" },
		{ "lang": "lg-eng", "name": "lot_skipped", "value": "Lot #{id} — already imported, skipped" },
		{ "lang": "lg-eng", "name": "lot_auction_linked", "value": " — auction #{id} ({status})" },
		{ "lang": "lg-eng", "name": "created", "value": "created" },
		{ "lang": "lg-eng", "name": "reused", "value": "reused" },
		{ "lang": "lg-eng", "name": "lot_auction_not_linked", "value": " — auction NOT linked: {reason}" },
		{ "lang": "lg-eng", "name": "lot_type_linked", "value": " — type #{id} ({citation})" },
		{ "lang": "lg-eng", "name": "lot_type_not_found", "value": " — type \"{citation}\" not found in catalog" },
		{ "lang": "lg-eng", "name": "lot_type_not_linked", "value": " — type NOT linked: {reason}" },
		{ "lang": "lg-eng", "name": "lot_imported", "value": "Lot #{id} (fields: {fields})" },
		{ "lang": "lg-eng", "name": "lot_images_created", "value": " — images: {images}" },
		{ "lang": "lg-eng", "name": "lot_images_not_imported", "value": " — images NOT imported: {reason}" },
		{ "lang": "lg-eng", "name": "lot_images_orphaned", "value": " — image record(s) #{ids} may remain without media; delete them by hand" },
		{ "lang": "lg-eng", "name": "lot_row", "value": "Lot {lot}" },
		{ "lang": "lg-eng", "name": "progress_counter", "value": " ({counter} of {total})" },
		{ "lang": "lg-eng", "name": "company_candidate", "value": "{name} (Entity #{id})" },
		{ "lang": "lg-eng", "name": "selection_count", "value": "{kept} of {total} selected" }
	]
}
